{
  "schema_version": "agent_session_receipt.v0.1",
  "session_id": "session-2026-07-10-001",
  "source_agent": "devin",
  "environment": {
    "host": "anvil",
    "platform": "darwin",
    "python_version": "3.13.13"
  },
  "tools_available": ["shell", "filesystem", "network", "connector", "test_runner", "write_access"],
  "repository_or_system_scope": ["hummbl-dev/hummbl-governance"],
  "starting_state": {
    "branch": "main",
    "head_commit": "abc123def456",
    "open_prs": ["PR #228", "PR #229"],
    "open_issues": ["#222", "#223", "#224"]
  },
  "actions_attempted": [
    {
      "action": "Created branch docs/constitution-archetype-and-authority-packets",
      "result": "succeeded",
      "evidence_ref": "git branch --list"
    },
    {
      "action": "Created ARCHETYPE_MATRIX.md",
      "result": "succeeded",
      "evidence_ref": "docs/research/constitution-integrity-remediation/ARCHETYPE_MATRIX.md"
    },
    {
      "action": "Created AUTHORITY_SOURCE_MATRIX.md",
      "result": "succeeded",
      "evidence_ref": "docs/research/constitution-integrity-remediation/AUTHORITY_SOURCE_MATRIX.md"
    },
    {
      "action": "Created draft PR #230",
      "result": "succeeded",
      "evidence_ref": "gh pr view 230"
    }
  ],
  "mutations_made": [
    {
      "artifact_type": "branch",
      "identifier": "docs/constitution-archetype-and-authority-packets",
      "created": true
    },
    {
      "artifact_type": "file",
      "identifier": "docs/research/constitution-integrity-remediation/ARCHETYPE_MATRIX.md",
      "created": true
    },
    {
      "artifact_type": "file",
      "identifier": "docs/research/constitution-integrity-remediation/AUTHORITY_SOURCE_MATRIX.md",
      "created": true
    },
    {
      "artifact_type": "pr",
      "identifier": "230",
      "created": true
    }
  ],
  "claims": [
    {
      "claim": "25 CONSTITUTION.md files found across PROJECTS/",
      "posture": "observed",
      "evidence_ref": "find /Users/others/PROJECTS -name CONSTITUTION.md"
    },
    {
      "claim": "hummbl-cyber-workbench and hummbl-cyber-workbench-issue20 have byte-identical CONSTITUTION.md files",
      "posture": "verified",
      "evidence_ref": "diff command output"
    },
    {
      "claim": "hummbl-governance constitution test count changed from 1168 to TEST_COUNT_AUTHORITY.md reference",
      "posture": "verified",
      "evidence_ref": "git diff of CONSTITUTION.md"
    }
  ],
  "decisions": [
    {
      "decision": "Create archetype matrix and authority source matrix as separate documents",
      "authority_source": "issue #223 and #222 requirements",
      "timestamp": "2026-07-10T14:00:00Z"
    }
  ],
  "negative_knowledge": [
    {
      "statement": "No CONSTITUTION.md files were modified or deleted in this session",
      "context": "Only new research documents were created"
    },
    {
      "statement": "No production code was changed",
      "context": "All changes are in docs/research/"
    }
  ],
  "open_questions": [
    {
      "question": "Should the 345-line founder-mode/PROJECTS/hummbl-doctrine CONSTITUTION.md be considered the canonical archetype?",
      "blocking": false,
      "owner": "operator"
    }
  ],
  "next_actions": [
    {
      "action": "Review PR #230 for archetype matrix completeness",
      "owner": "operator",
      "priority": "medium",
      "acceptance_criteria": "All 25 constitution files classified by archetype"
    },
    {
      "action": "Create bounded remediation packet for identified duplicates",
      "owner": "agent",
      "priority": "high",
      "acceptance_criteria": "Remediation packet with explicit per-repo actions"
    }
  ],
  "authority_boundaries": {
    "allowed": ["create branches", "create docs", "create draft PRs", "post bus messages"],
    "disallowed": ["merge PRs", "push to main", "modify CONSTITUTION.md files", "deploy"],
    "escalation": "Operator required for merge approval"
  },
  "receipt_destination": "github_pr_comment",
  "completion_status": "PARTIAL",
  "handoff_disposition": "INCONCLUSIVE"
}
